id,question,correctanswer,answera,answerb,answerc,answerd
100645,paper chromatography separate mixtures substances components carried mobile phase stationary absorbent an investigation analyzed sample black ink determine componentswhich property allows,a,solubility components mobile phase,evaporation components certain,magnetic property components,thickness paper stationary phase
100646,bacterial transformation,b,bacterium loses least gene,least gene inserted genome bacterium,bacterium transformed another,bacterium loses characteristics present before transformation occurred
100647,visible colors listed shortest longest wavelength violet blue green yellow orange red accurately compares frequency using,b,blue higher frequency violet,blue higher frequency green,orange lower frequency red,violet lower frequency yellow
100648,root emerges seed,a,against seed coat,pushing seed,gravity seed,pressing seed
100649,contain chloroplasts necessary production,b,water,food,dioxide,oxygen
100650,times rotate axis lunar month,a,one,two,three,four
100651,zygote,d,meiosis completed,egg meiosis,crossing occurs meiosis,sperm fertilizes egg
100652,runoff nearby farms deposit excess amounts nutrients bodies such lakes abiotic aspect lake,b,depth,levels fish,minerals,accumulation organic matter
100653,north america nebula named similarity shape american continent was discovered within milky way astronomer william herschel mr observing,d,explosion collapse star,dense cluster varying magnitudes,meteorites passed tail comet,cloud hydrogen dust where born
100654,structures flowering responsible producing pollen grains eventually fertilize ovules,a,anther,stigma,ovary,stamen
100655,bird been seen since 1900s considered extinct evidence disprove claim,c,bird watcher makes sketch,scientist discovers fossil remains bird,researcher takes photograph bird,park ranger finds suitable habitat bird
100656,saturn known moons regular orbits others irregular held,c,gravity saturn,gravity,gravity saturn,gravity saturn
100657,disorder associated certain flaws respiratory typical symptom,b,poor vision,difficulty breathing,reduced muscle,increased saliva production
100658,enclosed within membranes regulate interaction surroundings,c,fully permeable,nonpermeable,semipermeable,single layer
100659,mature sperm flagellum functions,a,propel sperm forward,release sperm,store sperm,produce semen
100660,order rocks classified igneous,c,solidify,eroded deposited layers,magma,pressure applied
100661,an oceanic plate subducts under continental these landforms interaction plates,a,volcanic mountains,transform boundaries,continental shelves,normal faults
100662,mixing baking soda vinegar makes solution release conclusion investigation valid,c,mixing chemicals caused them absorb,reaction took place,elements,procedure caused
100663,characteristic property indicates igneous cools slowly,d,mineral composition,hardness,density,crystal size
100664,station model,d,yearly average precipitation,daily average barometric pressure,lightning strikes,wind direction particular point
100665,by studying varying wavelengths universe been able figure out composition,a,stars,planets,various moons,earth
100666,sequence lists levels organization simplest complex,d,organ > tissue,tissue > organ,organ > tissue,> tissue organ
100667,antibacterial sprays often used cleaning kitchen countertops spray continuously survive reproduce,a,developed resistance spray,spray prevents multiplying,spray,sprays designed kill
100668,example pure substance,c,peanuts,milk,gold,air
100669,yellow main sequence stars similar white dwarf red giant,c,yellow main sequence stars frequently size either red giant white dwarf,yellow main sequence stars red giant white dwarf,yellow main sequence stars potentially brightness red giant white dwarf,yellow main sequence stars any similarities red giant white dwarf
100670,produces billions years,b,fission,fusion,winds,radiation
100671,stratospheric ozone levels reduced ultraviolet radiation hitting increases depletion often caused,b,reversal magnetic field,fluorocarbons released,electromagnetic waves,abrupt weather climate patterns
100672,group vertebrates lungs covered scales internal fertilization amniotic eggs describe,d,amphibians,birds,mammals,reptiles
100673,true wall,b,function help support protect,present animals,stiff rigid,present
100674,explanation vast craters,d,disappearance millions years ago,floor spreading,plate tectonics volcanic activity,impacts asteroids billions years
100675,according darwin theory evolution variations among finches he observed galapagos islands resulted,d,transmission acquired characteristics,disuse beaks,natural mutagens,natural selection
100676,a widow peak hairline humans coded dominant allele w straight recessive man homozygous ww produces zygote woman heterozygous trait combinations could occur,b,ww,ww,ww,ww
100677,florida bog frog lithobates okaloosae inhabits shallow stream overflows three counties with such small geographic habitat any could drastic population affect acid rain changed ph,b,prey insects become inedible,tadpoles unable survive,breeding sites become unavailable,predators choose another source
100678,hubble space telescope captured images distant star clusters containing million part structure,b,black hole,galaxy,nebula,solar
100679,processes eliminates waste using organs excretory organelle performs similar function humans cellular level,c,mitochondrion,endoplasmic reticulum,lysosome,golgi complex
100680,use consumptive instead returning source evaporates reservoirs transpires crops affect hydrosphere,c,reducing total,altering paths,shifting stages cycle,affecting climate way alters cycle
100681,electrons atom,a,electrons quickly around nucleus atom,electrons combined protons nucleus atom,electrons positively charged particles atom,electrons larger protons neutrons atom
100682,metal ball constant velocity zero quantity also,c,weight ball,ball,acceleration ball,inertia ball
100683,calculating distance space appear,b,speed,faster,directions,slower
100684,provides evidence crust divided tectonic plates,d,distribution,distribution biomes,distribution types,distribution earthquakes
100685,binary stars two orbit other being larger choose way astronomers knowing,a,brightness binary regularly,binary detectable radio telescopes,orbiting binary small rocky,binary unique spectral line pattern
100686,statements visible,c,electromagnetic wave single frequency makes small part spectrum,electromagnetic wave single frequency makes spectrum,includes range electromagnetic waves small part spectrum,includes range electromagnetic waves spectrum
100687,enzyme amylase produced cells salivary glands tongue,b,tongue contain amylase genes,tongue express amylase genes,varies cell based needs,cells tongue send amylase salivary gland
100688,cycle formation clouds back known,b,evaporation,condensation,transpiration,precipitation
100689,sentences relative size saturn,d,saturn much larger jupiter very small compared,saturn much larger mercury very small compared uranus,saturn much larger size venus,saturn much larger mars very small compared
100690,carpenter covered piece wood thin sheet paper he struck hammer impact left small hole smelled smoke kind transfer did event demonstrate,b,thermal,mechanical thermal,mechanical,mechanical
100691,caves rock formations include stalactites stalagmites where come,c,magma,rainwater,dissolved minerals,decaying organic matter
100692,called acid base combine produce salt,a,neutralization,dilution,titration,physical reaction
100693,as population small fish lake decreases depend,c,reproduce faster,begin produce own,decrease,number
100694,with relation currents gyres,a,whirls within basin,seamounts submerged basins,strong gale winds,another name tsunami
100695,often full observed,b,week,once month,every weeks,once leap year
100696,gravitational depends,a,distance them,direction orbits,planets,distance direction orbits
100697,an atom consists nucleus surrounded,d,ions,protons,neutrons,electrons
100698,term given rising plume mantle located below hawaii islands,b,convergent,hot spot,divergent,subduction
100699,nervous system works together communicate parts external spinal cord damage affect whole,c,controls actions brain peripheral nerves,important organ nervous,mediates communication brain rest,primarily involved communication external
100700,speed sound generally greatest,b,solids lowest liquids,solids lowest gases,gases lowest liquids,gases lowest solids
100701,concludes reaction performed classroom investigation exothermic to communicate validity conclusion visual evidence presentation,d,photographs reactants products,listing masses reactants products,listing start finish reaction,photograph flame produced chemicals reacted
100702,viral infection causes death significant individuals example,a,environmental factor,variation,evolution,diversity
100703,addition gases largest percentage,c,hydrogen helium vapor,hydrogen methane ozone,vapor nitrogen,methane helium
100704,travel flat glass,b,bend,continue straight line,bounce off glass,enlarge image
100705,natural variations ozone stratosphere,d,tilt axis variations ozone layer,el niño events variations ozone layer,variations ozone layer match changing location magnetic north pole,variations ozone layer follow pattern matches within cycle
100706,important event protein metabolism allows maintain homeostasis,c,kidneys filter out lipid soluble toxins,pancreas releases lipase break down toxins,liver converts ammonia urea excreted kidneys,hydrochloric acid stomach reacts remove harmful chemicals
100707,islands mid pacific region,d,land subsidence,deposition currents,wind erosion,volcanic activity
100708,cycle weathering erosion begin formation,a,sediments,magma,minerals,crystals
100709,using recommended amounts pesticide farmland yards gardens occur,c,higher levels pesticide may effective,pesticides may break down quickly,supplies contaminated pesticide runoff,pesticide production
100710,cells come basic types prokaryotic eukaryotic structure,d,vacuole,nucleoid,mitochondrion,cytoplasm
100711,organ systems work together unit prepare distribute,a,digestive circulatory,digestive endocrine,nervous respiratory,nervous excretory
100712,humus organic material makes soil characteristic indicates high content,a,color sample,sample,clay sample,sample
100713,season northern hemisphere experiencing tilted directly toward,d,fall,winter,spring,summer
100714,people may remove fallen trees forests reduce fire risk removing now thought impact health forest,c,increased risk forest fire,increased sources forest fungi,decreased fertility preventing nutrient recycling,decreased forest vegetation increasing sunlight penetration
100715,skin serves barrier protection against disease causing microorganisms known,a,pathogens,antibodies,histamines,antigens
100716,recently parents decided vaccinate children common childhood vaccines decision health officials expect see n,a,occurrence infectious diseases children,occurrence infectious diseases children,occurrence autism children,occurrence autism children
100717,pieces evidence gives support idea life existed planet billion years,c,billion year old meteorite antarctica,similar fossils south america western africa,simple life forms dated billion years old,billion year old igneous sample canada
100718,situation revising theory,d,reevaluating published well known,performing experiments cost effective,conducting surveys whether agree published,continuing research using advanced technology
100719,great ocean conveyer current runs north atlantic equatorial region got disrupted american european climates become,b,rainier,colder,windier,humid
100720,people who work science responsibility ethical example shows person failing maintain standards,b,meteorologist forecasted sunny day rain showers instead,researcher changed his so better support hypothesis,an archaeologist discovered evidence her past conclusions invalid,doctor prescribed treatment patient health had improved
100721,assumption geological processes today throughout earth long past allowed create theories idea known,a,uniformitarianism,superposition,inclusion,succession
100722,situation example feedback maintains homeostasis,d,mouse pushing lever release,dog going bowl bell rings,students receiving star stickers good behavior,brain signaling vessels return normal
100723,hookworms live inside intestines dogs as dog eats consume partially digested nutrient diversion become malnourished weakened relationship,a,parasitic relationship,mutualistic relationship,predator prey relationship,producer consumer relationship
100724,helium departed early history mechanism caused departure,b,helium attracted giants much closer orbit,heating allowed helium escape gravity space,biological reactions stored helium early life forms,reactions trapped helium crust
100725,nervous responsible sensing responding internal external stimuli however sensations responses don't become conscious individual until processed,c,motor neuron,sensory neuron,brain,interneuron
100726,student divides several cubes groups based whether cube float later property using classify,b,weight,density,conductivity,mass
100727,important sample size investigation,b,able compare,validity,conclusion,ensure procedure followed
100728,order evade extinction mutations produce adaptive traits,c,occur somatic,occur individuals,passed offspring,size
100729,part molecule represents encoded,c,phosphate,sugar,guanine,hydrogen bond
100730,factory japan had been dumping mercury into minamata bay certain microorganisms able plankton could happened next,b,built resistance mercury,mercury passed chain,plankton mercury safe,fish eat plankton
100731,least affect climate,c,elevation,latitude,longitude,topography
100732,earthquakes often happen along faults,d,new,small,large,existing
100733,could possible way prevent wildlife becoming endangered,b,drinking,establishing habitats,cutting down forests,stopping underground coal mining
100734,chemist discovered she thinks molecule order,c,properties elements,composed elements,elements,contain compounds bonded together
100735,tool compare growth algal colony growing petri dish,c,scale,ruler,hand lens,balance scale
100736,gene mutates bacteria reproduce asexually mutation inherited,d,types,non reproductive,missing gene,direct descendants
100737,where earthquake originate,c,sudden radiation striking,gravitational pull close orbit,under stress shifting deep inside,weight sediments pushing down bedrock
100738,repeated exposure extremely loud sounds reduce hearing ability direct damage structures,a,sensory neurons ears,interneurons ears brain,sound processing center brain,motor neurons applying commands brain ears
100739,forest cleared building resort before construction began secondary succession set appeared so rapidly,d,clearing allowed mosses grow quickly,weathering occurred lichens grow,exposed substrates allowed microbes grow,components remained grow
100740,simple machine increases distance load travels reduces needed,d,wheel axle,wedge,pulley,inclined plane
100741,there evidence continent antarctica once had tropical climate however moved southward current location south pole after breakup supercontinent pangea movement caused ecological,a,adaptations colder arid climates,adaptations low high moisture,extension producer roots anchor against earthquakes,extension producer roots absorb nutrients cooling magma
100742,forces direction magnitude units,a,° northwest,newtons,pounds,grams
100743,volume universe found space between galaxies objects regions closest size,a,dust particle,asteroid,planet,star
100744,dung beetle insect gathers waste animals rolls compact ball lays eggs buries gives warm safe place hatch provides source developing larvae impact ecosystem,a,helps return nutrients,makes animal waste harder degrade,causes unhealthy accumulation animal waste,depletes nutrients benefit young
100745,since nevada led united states production resource,a,gold,uranium,lumber,iron
100746,function performed similarly structured sites prokaryotic eukaryotic,a,protein synthesis,packaging transport proteins,storage material,release storage forms
100747,moves ion across membrane against concentration gradient,d,diffusion,exocytosis,facilitated diffusion,active transport
100748,may impractical object being studied could either too small order perform test such cases often construct,a,scale model,labeled diagram,map,drawing
100749,eye allow humans perceive color,d,rods,inked,corneal,cones
100750,scientist formulated rules describe observable relationships traits ancestor,b,linus pauling,gregor mendel,james watson,albert einstein
100751,negatively charged ion,c,heavier nucleus,greater atomic,electrons protons,electrons neutrons
100752,differences life cycles may revealed collection x ray,b,microscopes,telescopes,machines,crystallography
100753,coal generate electricity despite pollution produced burning,b,compared fuels coal produces per kilogram,compared fuels coal relatively cheap plentiful,coal burns without producing greenhouse gases,coal renewable source
100754,order boulders become sediments first,b,heated melted,weathered eroded,recrystallized,buried
100755,sahara desert africa great sandstorms stir dust where travels west across atlantic affect composition quality impact climate far away caribbean florida way saharan impacts southern,a,dust reflects radiation cooling,dust absorbs moisture clouds reducing rainfall,dust decreases static discharge preventing lightning storms,dust slows airflow causing weather systems stall land
100756,stanley miller harold urey sealed methane ammonia hydrogen flask simulate early exposed chemicals electric charges lighting did produce,d,bacteria,nucleic acids,viruses,amino acids
100757,fish live lakes frozen liquid water remains below ice property allows remain,b,dissolve substances,dense solid,mohs hardness frozen,holds higher temperatures
100758,important difference living things nonliving,d,compounds,elements,molecules,cells
100759,layer solid brittle comprises outer kilometers contains crust upper mantle called,c,core,sediment,lithosphere,hemisphere
100760,mr jones assigned his 7th grade science students research project specific disease source finding detailed topic,d,yellow pages,dictionary,fictional book,world wide web
100761,an atom whose nucleus emits traps particles element known,d,positive ion,negative ion,halogen,radioactive isotope
100762,classified malleable ductile while considered brittle,c,nonmetal semimetal,nonmetal metal,metal semimetal,semimetal metal
100763,cody notices colors on his tropical fish always seem dull right after he turns light then become noticeably brighter feeds so forms hypothesis brighten feeding tests observing several tanks them again photographs before marks friends try identify brightest examining concludes remain statements accurate regarding,c,enough present judgment regarding hypothesis,hypothesis supported repeated times sure accurate,hypothesis supported cody eliminated incorrect answer modify his,hypothesis supported thrown out
100764,galaxy,c,single star orbit around,several no,billions,just star
100765,characteristic common reptile,c,endothermic warm blooded,slimy skin,ectothermic cold blooded,hairy skin
100766,closed circulatory systems found mammals birds fish while open often insects squid means,b,fish closely evolutionarily related squid birds,humans closely evolutionarily related fish insects,squid closely evolutionarily related fish insects,birds closely evolutionarily related insects fish
100767,plant cells coated waxy layer prevents loss specialization,c,internal stem,internal root,surface,reproductive
100768,order eye color retinal,d,reflect white,known rods respond color,expand size pupil,react differently wavelengths
100769,explanation released wood burns,c,burning creates increasing particle motion,burning destroys matter creates,burning releases stored bonds,burning causes convection currents create
100770,measurement,d,chemical,mechanical,potential,kinetic
100771,jet plane moving constant velocity flat forces act against forward motion,c,gravity engine thrust,engine thrust friction,friction resistance,resistance gravity
100772,lab students working substances could burns safety precautions important follow,c,sinks empty,glassware clean,eye protection worn,electrical equipment off
100773,proper hypothesis always,b,supported evidence,testable using investigation,written using then,based experiments
100774,himalayan mountain chain youngest tallest phenomenon contributed area continental buildup,c,erosion surrounding continental materials,eruptions continental shield volcanoes,convergence continental plates,subsidence continental landmass
100775,organic living things contains,d,fats,carbohydrates,proteins,dna
100776,residents seaside town experience onshore breezes ocean during hot sunny days offshore land cool nights affect pattern,c,warm sinks moves onto land,cold rises over land moves,land heats cools faster,heats cools faster land
100777,fixing nitrogen,a,bacteria,fungi,protists,animals
100778,an ^ th grade student hypothesized sunlight tomato receives larger tomatoes grow statements represents investigation test hypothesis,c,tomato need sunshine food photosynthesis logically more means,informal exploratory observations garden those sunlight appear grow bigger,secure young tomato height place ten direct sunlight shade measure size tomatoes grown,secure young tomato height place ten direct sunlight shade measure growth
100779,carbon dioxide emissions increased due numbers automobiles industrialization been affected levels,d,ability farmers crops,ability study,ability continue recycling,ability maintain lower temperatures
100780,topography nevada dominated basins mountain ranges associated geological phenomena,a,faults,trenches,hot spots,hydrothermal vents
100781,key elements living important can join together molecules joining,d,water,dioxide,proteins,above
100782,natural selection drift drives,a,evolutionary,monstrous mutations,identical genetics,environmental
100783,increased populations lead depletion locally available resources compared communities depleted desert,d,mineral,oxygen,gasoline,water
100784,major geological events lead formation,c,volcanic eruptions destroy local habitats,climate migrations,mountain ranges isolate populations,meteorite collisions bring
100785,fires forests lightning rid forest dead branches leaves trees survive remains intact experience regrowth climax state,b,tropism,succession,gradualism,eutrophication
100786,feedback mechanism uses maintain homeostasis,c,copying material division,rejecting flu vaccine immune,perspiring lower,learning new behavior survive
100787,directions making protein,b,result,carried,amino acids,carried amino acids
100788,science class william out bacteria live soil function impact,a,help fertility decomposing organic matter,help fertility loosening root growth,reduce fertility breaking down minerals,reduce fertility stripping nutrients
100789,michelle interested improving quality soil her yard she wants penetrate add help achieve goal,d,bacteria,fertilizers,pesticides,earthworms
100790,before can become soil undergo certain processes formation involves plants chemically,a,weather acid,strip minerals,break small pieces,density
100791,red shift occurs waves,d,reflected,condensed,non existent,increased
100792,scientist often uses investigation determine steps needed next value using procedure,b,valid produced experiments repeated,evidence leads revised knowledge further research,experiments treated hypotheses instead conclusions,discussions identify investigations
100793,term identifies single unit hereditary,d,egg,sperm,nucleus,gene
100794,avoid becoming dehydrated field investigation hot day,a,drink bottle,wear wide brimmed hat,drink lot before leaving school,drink clear running stream
100795,an electrical circuit break down hydrogen produces,c,kinetic,physical,changes,potential
100796,true planetary motion,d,circle around,take days revolution around,orbit clockwise direction others counterclockwise,planets closest sun faster farther away
100797,outside,c,planets,moons,nebulae,comets
100798,iceland so active volcanoes,b,iceland overlies boundary tectonic plates colliding,iceland overlies boundary tectonic plates moving apart,iceland single tectonic plate far any boundaries,iceland single tectonic plate moving under another
100799,student wants find accurate account discovery took place within past three months sources look,d,newspapers,magazines,science textbooks,science journals
100800,uniformitarianism described,a,idea geologic processes gradually continuously shape,idea geologic processes immediately rarely shape,idea geologic processes shape way,idea geologic processes always gradual extremely rare
100801,goal taxonomy accomplish,b,differences living,classifies living groups,predicts types undiscovered,establishes relationships habitats
100802,happens ray white passes prism,d,ray combined single color,ray completely absorbed prism,ray light bent backward toward source,ray bent several pathways showing rainbow
100803,function small intestine,d,oxygenation tissue,excretion toxic wastes,transportation,digestion absorption
100804,high altitude cirrus clouds primarily substance,b,dioxide,solid ice crystals,nitrogen compounds,ozone
100805,scientist set four aquariums placed octopus fish crabs lobsters shrimp added hypothesis tested experimental setup,c,an octopus camouflage living aquarium,an octopus grow larger size relative aquarium,an octopus eat animals live seafloor instead those swim,an octopus lay sets eggs aquarium opposed set
100806,support hypothesis step take next,c,support hypothesis,perform without using control groups,observations another testable hypothesis,perform using larger variables
