id,question,correctanswer,answera,answerb,answerc,answerd
100001,athletes begin exercise heart rates respiration at level organization coordinate functions,c,tissue level,organ level,level,cellular level
100002,example learned behavior dog,c,smelling odors,barking disturbed,sitting command,digging
100003,nuclei combined nucleus slight release called,d,conversion,reaction,fission,fusion
100004,distinction epidemic pandemic,b,symptoms disease,geographical area affected,infected,season disease spreads
100005,way orbit comet,b,orbit circular comet,orbit comet elliptical,orbital period much longer comet,orbital period comet predictable
100006,a teacher builds model hydrogen atom red golf ball used proton green electron accurate concerning,b,particles,relative particles,types particles present,charges particles present
100007,substance apply skin he she gets splashed acid,a,water,vinegar,salt,formaldehyde
100008,main source cycle,a,sun,fossil fuels,clouds,ocean
100009,greatest effect aiding movement,d,tension,friction,density,gravity
100010,non volcanic mountains due interaction plate boundaries associated formation,c,oceanic plates colliding,oceanic plates separating,continental plates colliding,continental plates separating
100011,body average normal temperature ° f to keep core becoming too high brain sends signal,d,sugar levels,sugar levels,flow skin,flow skin
100012,explanation term ecology,d,study nonliving parts,study living parts,study protection renewal natural resources,study interactions
100013,farmer sprayed his orange trees pesticide eliminate insects damaging survived produced offspring also resistant insecticide illustrated resistance,a,natural selection,selective breeding,aerobic respiration,sexual reproduction
100014,researchers work teams cars fuel efficient statements main advantage working rather individually,c,research published,research costs perform,researchers share ideas,researchers complete work
100015,achromatopsia disorder sufferers no color vision affects structures eye,b,rod,cone,lens,iris
100016,elements organic compound,b,helium,hydrogen,mercury,tin
100017,principle learn structure interior,c,solid materials absorb seismic waves,magnetic fields deflect seismic waves,density material affects speed seismic wave,physical state material determines amplitude seismic wave
100018,scientist looks graph shows percentages humus clay sand had total weight material instead illustrate,a,bar graph,scatterplot,circle graph,pictograph
100019,robots perform tasks dangerous humans major limitation,b,assembly pieces very small,assembly remain exactly,robots require regular maintenance,robots provided electricity
100020,investigated percentage obtained several sources eagles format way display,b,table,pie chart,bar graph,line graph
100021,voyager ii space probe launched mission flying past outer giant collecting unit measurement describe distance traveled reach neptune,c,meters,kilometers,astronomical units,years
100022,cellular structure allows nutrients pass,c,mitochondrion,nucleus,membrane,chloroplast
100023,behavior help animals establish territory,c,caribou herd migrates seasonally,scent trail leads ants source,wolf pack howls warn wolves stay away,honeybee society divides work members
100024,brain spinal cord nerves organs perform primary function,d,supporting enabling,transporting wastes nutrients throughout,producing male female gametes,conducting messages coordinate functions
100025,sample,a,retain volume transferred larger container,keeps shape transferred larger container,its volume greatly reduced adding pressure,its shape changed increasing
100026,condition bees called colony collapse disorder occurs worker leave hive collect nectar never return decline bee affect farm ecosystem,b,there thickness,there decline fruit production,there diseases,there insect pest populations
100027,set contains kingdoms contain heterotrophs,d,protists fungi,animals,fungi,animals fungi
100028,passes lens your eye produces image retina,d,smaller,larger,upright,inverse
100029,researchers share findings validate study effectiveness medication,b,e mail research local newspapers,publish research journal,publish brochures doctors,discuss research internet
100030,ancient greeks tried discover laws universe thought logic part missing,b,analysis,experiment,conclusion,observation
100031,scientists investigate nature gravity beneficial them review work who studied past,b,ensures investigations study identical topics,provides perspectives research topic,prevents studying topics relevant,gives access any may missing investigations
100032,greatest contributor pollution united states,b,factories,automobiles,power,burning waste
100033,ozone content stratosphere important living,b,ozone absorbs infrared radiation,ozone absorbs ultraviolet radiation,ozone necessary create living things,ozone prevents radiation
100034,an ecosystem community interacting physical decomposers important part ecosystems,a,break down dead return nutrients,produce own survival,play role preventing weathering erosion,provide consumers
100035,populations respond changing environments,a,adaptation,competition,ecological succession,extinction
100036,sequence amino acids protein determines,d,properties,shape,size,above
100037,research team wanted produce smaller variety german shepherd dogs mated smallest litters several generations example concept,c,extinction,mutation,selective breeding,natural selection
100038,as glacier melts retreats layer bedrock exposed term establishes community,b,disturbance,succession,weathering,stabilization
100039,areas world experiencing desert like conditions favors survival ability,b,consume amounts,become dormant long periods,sense infrared ultraviolet,transpire skin
100040,birds living certain coastal high level concentration pesticides bodies conclusion,d,pesticides exist naturally,picked pesticides coastal soils,high tides brought pesticides nesting areas,fish consumed birds contaminated pesticides
100041,main function circulatory,d,secrete enzymes,digest proteins,produce hormones,transport materials
100042,lowest level chain,a,autotroph,heterotroph,carnivore,omnivore
100043,with climate transfer energy three mechanisms,a,conduction convection radiation,reflection retention radiation,convection nuclear reflection,conduction nuclear
100044,scientist searches fossils sedimentary rocks find types,a,mold buried sediment,live areas where sedimentary,types difficult examine compared sedimentary,sedimentary common
100045,nature sound,c,sound travels fastest,sound travels faster,sound travels longitudinal waves,sound travels transverse waves
100046,gastroenterologist doctor who treats problems esophagus stomach intestines organ cared,c,circulatory,muscular,digestive,nervous
100047,wildflowers growing floor dense forests bloom early spring reason,a,canopy trees developed leaves so wildflowers get,butterflies pollinate flowers active early spring,there fewer animals eat flowers before pollinated,early spring warmest year so wildflowers grow easily
100048,remains constant cycle,a,total available,way,physical state containing,molecule particular atom
100049,correct order waves according increasing wavelengths,a,x rays > ultraviolet visible microwaves fm radio waves,microwaves > x rays ultraviolet fm radio waves visible,visible > x rays ultraviolet microwaves fm radio waves,fm radio waves > microwaves visible ultraviolet x rays
100050,core protostar reached around million k pressure within so immense nuclear fusion hydrogen begins born,b,red giant,star,super red giant,black hole
100051,family owns vacation cabin located hillside below station leaking gasoline storage tank situation drinking contaminated,c,pumped cabin distant reservoir,family brings several gallons bottled spring,groundwater drawn buckets private well,family collects rain barrels left open
100052,scientist working package design wants material highly recyclable biodegradable inexpensive,b,aluminum,cardboard,plastic,glass
100053,male testes located external scrotum,a,normal too warm sperm production,external scrotum offers better protection testes,sperm produced testes stored epididymus,sperm mix seminal fluid before exiting penis
100054,three major types,d,metamorphic intrusive extrusive,sedimentary metamorphic granite,igneous metamorphic pumice,igneous metamorphic sedimentary
100055,determines long takes complete cycle phases,b,period rotation around axis,period revolution around,period rotation around axis,period revolution around
100056,arabidopsis thaliana has gene been show unusually high mutation conclusion supported observation,d,gene codes flower color,gene controlled heredity,traits associated gene beneficial,traits associated gene may vary greatly
100057,true natural resource,a,renewable resource requires good stewardship,renewable resource so supply cannot exhausted,nonrenewable resource requires good stewardship,nonrenewable resource supply cannot exhausted
100058,person experiences flight fight response danger takes place,a,heart muscle contracts faster increasing blood flow vessels,heart valves close increasing volume stored chambers,breathing slows down allowing absorb efficiently,blood vessels relax dilate letting flow though them quickly
100059,practices support claim led discovery,b,reporting sharing researchers,having successfully replicate,keeping complete detailed accurate records,being willing publish so could study them
100060,student adds detergent cup mixture shaken allowed settle observes silt particles stay suspended long after layers bottom jar explanation,c,organic,dissolving,dense,moving faster
100061,low immediately lose ability,a,remain rigid,absorb sunlight,release,reproduce again
100062,female opossum give birth offspring increases larger litter,d,mature,reliable sources,maternal care per offspring,likelihood survive reproduce
100063,four students investigating effect baseball bat ball marked points where each balls contact after strike error experimental design,d,failure conduct enough trials,considering spin ball,using balls masses,failure define testable variable
100064,trees located,d,releasing nitrogen,crowding out non native,adding,removing returning
100065,moving gases out entire involves,d,digestive,nervous,excretory,respiratory
100066,blood pressure often indicator cardiovascular health measured units,b,cmhg,mmhg,g cm ^,g mm ^
100067,characteristic object small volume,a,high density,low pressure,low viscosity,high
100068,frost wedging occurs broken smaller pieces freezing expanding cracks rock considered part step cycle,a,weathering,transportation,deposition,lithification
100069,clearing forests trees vegetation development major impacts ecosystem occur after forested area cleared,c,habitat wildlife,competition,erosion,runoff
100070,relationship force mass represented equation = x acceleration object increases no,c,increase,not,decrease,direction
100071,plant grows red flowers crossed kind white their offspring grew pink,c,offspring experienced mutation,offspring resulted asexual reproduction,genes flower color exhibited incomplete dominance,gene pink colored flowers recessive parents
100072,fossil records show began evolving earliest life forms first seen record,b,multi celled,single celled,fungi,viruses
100073,modern technology had positive negative effects society effect advances,a,jobs replaced efficient machines,production solid waste,alternate sources,reduction habitat destruction
100074,lifting weight arm requires,c,flexion muscle groups,extension muscle groups,flexion extension muscle groups,neither flexion extension muscle groups
100075,atom neutral charge particles within equal numbers,b,electrons neutrons,protons electrons,neutrons protons,ions neutrons
100076,extinction likely organisms variation face,a,reproduce asexually,size,primary producers,reproduce sexually
100077,organ directly works protect disease,d,heart,kidney,pancreas,skin
100078,unequal forces act opposite directions moving object,d,absorb forces,come immediate stop,continue direction,direction larger
100079,sodium atom chlorine react chemically,b,element,compound,electron,neutron
100080,electric circuits provide lightbulbs prevents flow electrons,c,circuit closed,series circuit,circuit open,parallel circuit
100081,scientists conducting research medicine promising evidence helpful work maintain accurate records throughout study important,d,records help prove worked hard complete research,records possibility drug sold major pharmacies,records correct so paid,records help prove validity work
100082,functions carbohydrate lipid similar,a,source,replicated meiosis,lower activation reactions,dissolve nutrients digestive
100083,causes free falling object accelerate,b,inertia,gravity,initial speed,initial direction
100084,correctly reactants,b,substances,substances present before takes place,symbol separates substances present before after,substances written right hand side reaction equation
100085,greatest known explosion event history where appeared first,a,cambrian explosion,permian explosion,cretaceous tertiary explosion,asteroid explosion
100086,part atom involved reactions,b,nucleus particles,negatively charged particles,neutrally charged particles,positively charged particles
100087,formation compound,c,mixing coloring,mixing iron filings nails,combining sodium chlorine chloride,melting solid
100088,constant motion occurs no change speed direction while accelerated measure object,c,distance,speed,velocity,direction
100089,flower petals hydrangea color acidity changes directly related factor,d,gravitropism,photosynthesis,geographic location,environmental conditions
100090,function mitochondria,a,release growth development movement,attach carbohydrates lipids proteins,rich,assemble proteins
100091,central vacuole largest plant organelle store wastes causes taste bitter animals try eat vacuoles specifically within,b,tissues,cells,organ systems,organs
100092,difference atomic number element,d,ions,protons,electrons,neutrons
100093,event might dramatic history life,d,blizzard,flood,earthquake,asteroid impact
100094,inside special carry messages membrane nucleus uses similar,a,endocrine,lymphatic,excretory,integumentary
100095,methane burned vapor products since reactants gases invisible clues tells you reaction taken place,d,elements rearranged,elements produced,absorbed,produced
100096,competition among males mating season important animal,a,ensures genes fittest animals passed,allows females distinguish adult juvenile males,provides ways communication,speeds reproduction
100097,short thick fleshy stem extensive roots blooming period environments,b,prairie,desert,coniferous forest,deciduous forest
100098,fossil evidence tell us except,d,biological diversity kinds lived,episodic speciation species suddenly appearing after millions years without,extinction sudden disappearance evidence,mutation fast mutations occur within
100099,primary reason providing detailed accurate records investigations,d,reports longer,so published,demonstrate professionalism,so experiments replicated
100100,half volcanic formation seen pinnacles national park california side san andreas fault other miles southeast line evidence theories,b,earthquakes volcanic activity,crust rocky plates shift,formations may hundreds miles earthquake,earth current landforms created cooled
100101,margaret running full lap around circular track she facing north starts direction after completed half,b,north,south,east,west
100102,paleontologists find study fossilized determine history evolution life paleontologist,d,ancient life forms younger layers sedimentary,recently evolved undisturbed sedimentary layers,ancient life forms overturned sedimentary layers,recently evolved younger layers sedimentary
100103,students learning types waves least way generate wave,a,tossing ball,shaking ends rope,throwing pebble pool,pulling coiled spring toy
100104,classified orders class statements true,b,genus,phylum,kingdoms,members
100105,order cellular respiration occur necessary,b,dioxide,glucose,water,atp
100106,evidence geologist need support plate tectonic theory,c,fossils similar size,weathering erosion coastlines,crust sea floor spreading,physical appearances
100107,an athlete running race needs energy organelle s supply cellular functions,b,golgi apparatus,mitochondrion,ribosome,nucleus
100108,galaxy shapes range flattened spheres rounded elongated,b,irregular galaxy,elliptical galaxy,spiral galaxy,eclipse galaxy
100109,acid rain affect forests,d,top loses nutrients,begin grow deeper roots,animals sources,trees become healthy
100110,water cycle movement earth salt found oceans while remaining fresh where majority freshwater,c,groundwater aquifers,swamps wetlands,ice caps glaciers,lakes rivers
100111,condition required hardy weinberg equilibrium no gene flow occur highly unlikely happen nature,c,mating always occur nature,continuously die removing genes,migration add remove genes,selection eliminate certain genes
100112,trees removed area tropical rainforest experiences soil erosion removing lead,b,bedrock available,there fewer roots hold place,eating insects area,radiation reaching ground
100113,finger cut bleeds platelets plasma proteins move stop bleeding as stimulates mechanism being illustrated,b,negative feedback,positive feedback,regulatory feedback,stimulation feedback
100114,choices contain element,c,metal rod,table salt,lily,distilled
100115,scientist crosses red flowered plant white offspring flowers crossed,c,offspring red flowers,offspring white flowers,offspring either red white flowers,offspring neither red nor white flowers
100116,girl long hair going participating experiment uses alcohol burner source thing her prepare,c,leave her jacket locker day,goggles,tie her hair back away face,wear lab apron
100117,happens crops rotated year,a,nutrients depleted,fertility increases,becomes porous,erodes rapidly
100118,nervous controls coordinates functions__________,d,throughout brain,spinal cord,throughout brain spinal cord,whole responding internal external stimuli
100119,processes could formation high mountains well rounded peaks,c,volcanic eruptions global warming,earthquakes tidal activity,collision crustal plates erosion,production greenhouse gases weathering
100120,energy gasoline transformed mechanical motorcycle engine,a,chemical,nuclear,magnetic,electrical
100121,processes cycle primarily responsible creation lake,c,evaporation runoff,evaporation condensation,precipitation runoff,precipitation condensation
100122,insect populations able survive repeated attempts eradicate them insecticides,b,cockroach populations good finding sources,cockroach populations genetically able adapt quickly,cockroach populations leave being poisoned,cockroach populations know stay away poisoned areas
100123,in tropical rainforest difference between daytime nighttime temperatures relatively small desert very factor contributes lower variation,d,foliage rainforest reflects,rainforest absorb moisture,radiation rainforest intense,cloud cover rainforest helps retain
100124,ribosomes sites processes,d,nucleotide synthesis,transcription,lipid synthesis,translation
100125,chlorophyll pigment within chloroplast cell find sample know came n,a,plant,animal,human,bacteria
100126,occurs renal fails work,c,exchange impaired,oxygenation no longer occurs,metabolic waste builds,nutrients no longer transported organs
100127,17th century galileo proposed hypothesis explain how suction pumps work disproved later helped torricelli development instrument measuring atmospheric pressure did help technology,d,leading galileo design technology,allowing another scientist critique galileo hypothesis,providing evidence effects atmospheric pressure,inspiring another scientist test alternative hypothesis
100128,drought affect grassy plain,a,there shorter,thicker stems,there greater variety,brighter flowers
100129,favorable variations reproduce higher rates those without such,b,disruptive selection,natural selection,sexual selection,directional selection
100130,phase forms clouds,c,evaporation,freezing,condensation,melting
100131,relationship exists dog fleas,d,commensalism,gradualism,mutualism,parasitism
100132,volcanic island arc plate boundary,b,divergent oceanic,convergent oceanic,divergent continental oceanic,convergent continental oceanic
100133,protein synthesis carried out nucleus ribosome,c,rrna,trna,mrna,dna
100134,complementary base adenine,b,cytosine,thymine,guanine,uracil
100135,meteoroid becomes meteorite,a,impacts planet,encounters planet,makes complete orbit around planet,starts burn planet
100136,pure substances combine new substance cannot physically separated boiling point original classified,d,atom,mixture,element,compound
100137,investigating reaction expect products,c,properties reactants separately,mixture properties reactants,properties reactants separately,properties reactants
100138,statements thermal true,d,as you hold cup hot your hands cool,as you hold glass cold milk travels your hand,as you hold cup cold milk your hand cools,as you hold cup hot moves your hand
100139,technology generate electrical power involves trade off economical electricity long term waste disposal problems,b,fossil fuel,nuclear reactor,collector,wind turbine
100140,sooj learned whales vocalization navigate communicate think noise pollution whale habitats may harm populations effect,d,alteration whale material,reversed flow whale habitats,reduced populations whale habitats,separation whale family groups
100141,measurement tool find volume small piece granite,c,thermometer,metric ruler,graduated cylinder,triple beam balance
100142,barometer measure,c,wind speed,temperature,atmospheric pressure,humidity
100143,atomic model includes nucleus positive charge,c,spread evenly throughout model,located multiple sites model,concentrated center model,positioned outside center model
100144,fruit flies traits yellow white eyes always inherited together conclusion drawn phenomenon,c,traits controlled gene,traits dominant,genes traits adjacent genome,allele trait
100145,activities contribute extinction,c,hunting,habitat destruction,restoration ecology,introduced nonnative
100146,repeating experiments improves likelihood accurate results overall,d,prove hypothesis correct,prove hypothesis correct,correct due fewer errors being,correct due fewer errors being
100147,heart chambers responsible contractions generate pressure forces rest,c,left atrium,right atrium,left ventricle,right ventricle
100148,involves formation substance,d,evaporation gasoline,mixing salt pepper,dissolving sugar tea,rusting iron chain
100149,blue shone yellow banana color appear,d,blue,yellow,green,black
100150,fold observed layers sedimentary resulted,b,cooling flowing magma,converging crustal plates,deposition river sediments,solution carbonate minerals
100151,benefit having control group,a,variables may eliminated,subjects needed experimental group small,may occur control group easily explained,variables needed group easily determined
100152,trees narrow tubes transport water upward property allows rise,c,high vapor pressure,high boiling point,cohesion,net charge
100153,property ice allows fish survive ponds temperatures below ° c,a,ice floats insulating warmer below,ice sinks leaving fish,ice slows fish metabolism until warm spring temperatures them,ice allows enter temperatures below freezing
100154,formation himalayan mountains example land features caused compressive forces action led,c,seafloor spreading,strike slip faulting,colliding plates,hot spots
100155,region milky way contains consists mostly old,a,halo,spiral arms,nuclear bulge,open clusters
100156,you roasting marshmallows your family burn marshmallow notice black substance dad tells products reaction,c,marshmallow,oxygen,carbon,fire
100157,as populations size individual start exhibit various symptoms including aggression lack caring young decreased fertility increased susceptibility disease,d,decrease,stay,shift,increase
100158,students weather observations outside school building then record observation recorded fact,b,feels very cold,wind blowing m s,nicer day before,looks like might warm later
100159,order succession natural communities occur york state,d,grasses > trees bushes,trees > bushes grasses,bushes > grasses trees,grasses > bushes trees
100160,composite material,d,glass window,bronze statue,aluminum,fiberglass bumper
100161,school districts placing dispensers hand sanitizer classrooms computer labs purpose practice,d,conserve resources,control noninfectious diseases,promote safe technology,limit diseases spread contact
100162,prior experiments hershey chase remained unconvinced exact location material living things mainly chromosomes composed,b,rna,protein,mitochondrial,chromatids
100163,improvements farming technology,a,produced,global climate conditions,promote unhealthy dietary choices,daily exercise
100164,northern hemisphere tilted toward season occurring australia,b,fall,winter,spring,summer
100165,generate amounts energy nuclei small mass undergo fusion larger four basic forces universe responsible released,b,weak,strong,gravitational,electromagnetic
100166,objects orbiting kuiper belt,d,metallic,rocky,hot,icy
100167,an air valley travels mountainside causes movement,c,tidal pull gravity,evaporation valley,warming re radiated ground,cooling effect ice crystals mountain
100168,characteristic viruses distinguishes them,c,hereditary material,separated environments,lack independent metabolism,their traits evolve response selection pressures
100169,insulator against flow electricity,c,copper wire,steel tubing,plastic tape,aluminum foil
100170,birds receive adequate nutrition development sing often shorter periods adult outcome nutritional stress songbirds,d,ward off predators,obtain good nesting sites,find adequate supplies,attract mates pass genes
