id,question,correctanswer,answera,answerb,answerc,answerd
101787,hillside along highway exposed layers undisturbed sedimentary rock method determine relative age,a,apply law superposition,calculate radiometric decay,apply law crosscutting relationships,calculate tectonic plate movement
101788,protists single celled eukaryotic reproduce,c,sexual reproduction,asexual reproduction binary fission,asexual reproduction mitosis,asexual reproduction budding
101789,students investigating effect plant extracts growth bacteria grow colonies separate dishes using medium expose each colony four observe days method presenting,c,list counts collected,pie chart comparing amounts extracts,line graph comparing counts exposed extract,set notes written each day observation
101790,sensory neuron first receive stimulus structure,a,dendrites,body,axon,axon terminals
101791,light bulb manufacturer claims twice bright per unit electrical consumed leading claim correct factor accurately compared bulbs,c,much bulb weighs,long bulb lasts,much bulb releases,much metal bulb contains
101792,granite igneous usually happens after weathered broken small particles buried deep underground compacted,a,granite becomes,granite forms active volcano,granite becomes part deep fault,granite forms tall mountain
101793,layer sedimentary shows evidence extinction end cretaceous period worldwide this much higher level element iridium indicating high likelihood asteroid impact known,d,cenozoic era,permian extinction,dinosaur extinction level,k t boundary
101794,group called chemosynthesis,b,scavengers,producers,consumers,decomposers
101795,inherited trait humans,d,height,hair color,skin color,intelligence
101796,rain forests contain trees any biome however forest floor relatively nutrient poor could account,b,lack weathering reduces availability minerals,nutrients being utilized life,forest floor get enough sunlight,animals eat nutrients
101797,precipitation occurs raindrops freeze fall,c,hail,frost,sleet,snow
101798,dating technique order determine sequence geological events history,d,radioactive dating,radiometric dating,dating,relative dating
101799,tv commercial claims star bleach gets white clothing just max scientist test claim,b,select bleach brand compare takes clean piece clothing,cut dirty cloth half wash piece separate loads advertised bleaches,analyze advertised bleach brand determine active ingredients,wash load clothes mixture bleaches
101800,camouflage mimicry examples,d,mutation,evolution,analogous structures,adaptation
101801,statements true regarding compounds,d,compounds retain properties elements composed,compounds composed element,compounds simplest element retains properties,compound resemble elements composed
101802,living largely hydrogen nitrogen phosphorus sulfur types,b,electrons,elements,molecules,cells
101803,way find electronic resources world wide web,a,using keyword search engine,checking author work cited page,searching card catalogue,using word processing software
101804,landslides principle natural hazard california conditions prone occur,c,once active volcanoes become dormant,normally wet areas dry drought,uplifted areas weak underlying sediment,seismic activity along fault lines increases
101805,gravitational force affects our influenced,b,axial tilt,orbital path,masses,moons per planet
101806,male barn swallow birds symmetrically shaped wings find mates quickly males asymmetrical wing shapes significance symmetry,a,symmetrical wings attractive females,symmetrical wings indicate mutations,symmetrical wings indicate males good predators,symmetrical wings signs bird very aggressive
101807,enzymes work environments neutral ph measuring investigator predict value,c,2,5,7,13
101808,emitted electrons,d,atom another,collide another releasing,lower energy level higher,higher energy level lower
101809,studying characteristics stream protons electrons boil corona known,c,flare,spot,wind,corona flare
101810,hunting single animal threaten entire ecosystem,a,disrupting web ecosystem,causing scale habitat destruction,introducing nonnative,causing sudden climate
101811,rolando wants see what temperature various liquids boil he boils tap water records then milk added sugar purpose boiling plain first,d,include factor manipulate,possible explanation problem,variable while observing others,provide standard compare
101812,newly proteins modified organelle,b,ribosome,endoplasmic reticulum,mitochondrion,nuclear envelop
101813,mutation occurs passed offspring,d,blood,nerve,brain,egg
101814,object energy transform electrical,c,candle,mirror,flashlight,television
101815,characteristic differentiation developing embryos,c,genes present,copies gene present,genes active,protein produced gene
101816,discovered fossilized remains land reptile lived million years ago coasts south america africa claim supported discovery,c,types south america africa,animals south america africa related reptiles,south america africa moving slowly away,sedimentation south america africa caused fossilization reptiles
101817,characteristic extinct makes suited index fossil,c,whose fossils show evolutionary,common specific types environments,commonly fossilized specific period,whose fossils ranging age ancient recent times
101818,displayed pie chart,a,survey preferences lunch,comparing volumes absorbed sponges,measurement growth given amounts fertilizer,investigation boiling altitudes
101819,sodium hydroxide reacts copper nitrate solution reaction vessel needs kept ice slow down,b,exothermic reaction absorbs,exothermic reaction releases,endothermic reaction absorbs,endothermic reaction releases
101820,plants forest need obtain nutrients soil survive get back once them growth,a,organic matter recycles dead,commercial fertilizers applied humans,radiation reaches ground,rainwater drips off living
101821,elements necessary living,b,helium,sulfur,fluorine,silicon
101822,calcium fortified juice advertise good growing children,a,calcium helps growth bones,calcium provides growth,children need drink lot fluids,children need calcium prevent allergies
101823,heated unevenly causing,a,wind patterns,cloud formation,volcanic activity,condensation
101824,uranus outer average distance billion kilometers revolves orbit instead moving out space,b,orbit neptune limits uranus,gravity pulls uranus toward,electromagnetic pulls uranus,uranus
101825,nervous system composed tissues organs,d,brain,spinal cord,ganglion,neuron
101826,replication cytosine c pairs,b,adenine,guanine g,thymine t,uracil u
101827,exotic melaleuca australian pine has increased intensity fires across everglades fuel available due presence releases massive numbers seeds response fire drought herbicide damage reason been able survive,a,adaptation,competition,diversification,mutation
101828,greek philosopher aristotle described matter phrase unable divided modern concept grew idea,a,atom,proton,neutron,electron
101829,person cuts down living oak tree burns wood boil sequence correctly orders transformations occurred boiling,a,energy > thermal,thermal energy >,energy > mechanical electrical,electrical energy > mechanical
101830,organisms greater genetic variation survive major,b,reproduce asexually,reproduce sexually,primary producers,larger size
101831,evidence suggests relationship ancient dinosaurs modern birds occurrence trait resulted,a,mutation genes,hybridization,extinction populations,alteration
101832,elements combined n,c,atom,electron,compound,element
101833,publish papers describing conclusions experiments members community,b,collect own rewrite paper,evaluate evidence paper,accept paper fact,ask writer write alternate paper
101834,mixes oil flask after while separate layers,c,substances act solvent,substances act solute,neither substance act solvent,neither substance able solutions
101835,triple beam balance taken moon measure cup would same mass on reason,c,lack significant affect inside cup,gravity too low balance measure correctly,property constant regardless location object,pull gravity affect triple beam balance
101836,animals prey classified,b,herbivores,carnivores,autotrophs,decomposers
101837,gravitational between objects depends distance object,a,mass,volume,pressure,temperature
101838,characteristic cell membrane allows control materials entering leaving,b,membrane surrounded fluid,membrane semipermeable,membrane holds organelles place,membrane animal
101839,an traits largely determined makeup parents mutation kinds parent could trait appear offspring,a,sperm egg,egg nerve,nerve muscle,muscle sperm
101840,visiting local limestone quarry finds fossils seashells located hundreds miles indicate,a,area once below sea level,global changed,erosion took place after flood,volcanic activity affected area
101841,darwin studies he observed various finches were well suited environment galapagos islands better,c,become extinct,migrate islands,survive reproduce,artificially selected
101842,factor release antidiuretic hormone adh posterior pituitary gland,a,consuming salty snack hot day regulated negative feedback,being well hydrated regulated negative feedback,consuming salty snack hot day regulated positive feedback,being well hydrated regulated positive feedback
101843,first step formation sedimentary,a,erosion,deposition,compaction,cementation
101844,key physical beach formation wave action sand deposited beaches waves break onto shoreline energy scatters modify shape,d,thermal,potential,chemical,mechanical
101845,water cycle mainly involves transport vapor considering three stages ecosystem described,a,physical,process,biological,an ecological
101846,atmospheric phenomena created interaction charged particles magnetosphere,a,auroras,tornadoes,rainbows,inversions
101847,unable import substances required malfunctioning,a,membrane,endoplasmic reticulum,golgi,nuclear envelope
101848,before letting students hammers investigate various minerals break question teacher ask,a,is everyone wearing goggles,who get minerals shelf,purpose investigation,someone volunteered drawings breaks
101849,an element considered isotope,a,neutrons,protons,electrons,levels
101850,described gases dust matter orbits common center gravity,b,asteroid,galaxy,nebula,comet
101851,factor greatest influence southern migration animals living northern hemisphere,c,strong storms,long periods drought,cold temperatures,increasing daylight hours
101852,primary advantage sexual reproduction compared asexual,c,there greater offspring,there available offspring,there greater variety offspring,there longer development offspring
101853,evidence indicates magnetic field reversed direction times throughout history after reversal affected,d,length severity seasons,formation tectonic plates,direction rotation axis,alignment minerals newly crust
101854,distance smallest practical year unit measurement,d,distance,distance jupiter,distance milky way nearest galaxy,distance center milky way
101855,compared red star greater,a,volume,rotation,surface,orbiting
101856,river course so mice subdivided populations forest eastern side stream contains land predator absent western outcome occur generations,c,mice western side stream better camouflage,mice eastern side stream chromosomes,groups mice become,groups mice continue eat
101857,cancer treatment,d,drug kills very small,drug kills very,drug kills slowly dividing,drug kills rapidly dividing
101858,student measuring graduated cylinder tall enough read measurement eye level action take correctly,d,stand chair,estimate,pour out until eye level,graduated cylinder lower table
101859,gaseous sulfur dioxide compound combines acid rain primary source,b,volcanic emissions,combustion fossil fuels,destruction tropical forests,mining mineral extraction
101860,relationship earth outer core inner generates portion magnetic field,b,relative masses,relative motions,relative diameters,relative circumferences
101861,pest control company hires scientist determine aphids ladybug eats hour going record her observations present step beneficial show investigation valid,a,maintain accurate records investigation,record date place investigation been concluded,release ladybugs after investigation been concluded,have employee pest control company monitor investigation
101862,magician claims able assistant his mind claim cannot true,a,object motion acted,object acted motion,objects acted balanced forces,object motion remain rest unless acted upon
101863,as rain forest deforestation lose habitats also effect,b,erosion,fertility topsoil,production medicines,produced
101864,teacher told alex sure replicate his experiment required,c,shows he control his,shows he conducted once,shows he attempted reduce occurrence errors,shows he sure second set first
101865,true,b,human,pre existing,contain flagella,contain least trace amounts chlorophyll
101866,magnetic field reveals details planet interior,b,magnetic anomalies reveal differences origins material crust,magnetic anomalies reveal variations amounts material crust,shape earth magnetic field indicates material core,shape earth magnetic field indicates volume material core
101867,fossil elephant african savanna much longer tusks larger presently inhabiting area reveals,d,diet early elephants,elephants travel herds,function trunk elephant,physical occurred elephants
101868,sudden environmental lead chance populations,d,mutations survive,populations survive,unfavorable traits survive,favorable traits survive
101869,population void predators able satisfy needs experience__________,a,exponential growth,habitat degradation,habitat loss,habitat fragmentation
101870,animals continued burning rain forests africa,b,erosion,destruction habitats,improved nutrients,grasses burning
101871,evidence suggests hot spots may response twisting stresses plates theorized eventually splitting apart tectonic plate area spot geographic features affected,b,himalayas,hawaiian islands,san andreas fault,mid atlantic ridge
101872,section oral presentation experiment would you describe thought happen,c,problem,conclusion,hypothesis,procedure
101873,fever response disease causing agent infecting body raising shape enzymes so cannot reproduce,b,fever internal response external stimulus,fever internal response stimulus,fever external response stimulus,fever external response internal stimulus
101874,scientists analyzed animal determine infection did agree analysis disagreement indicate nature science,b,present formats,interpreted ways,capable making unsupported claims,results often expected
101875,chemist observed bubbling fizzing after adding acid solution white powdery substance beaker inferred,b,acid boiled poured beaker,acid powder product,physical reaction produced mixture,reaction occurred produced
101876,major organ nervous,a,brain,stomach,lung,bone
101877,rat snakes elaphe obsoleta distinct populations different areas markings colorings where gray,c,forest,swamp,gravel pit,corn field
101878,meiosis contributes reproduction producing,c,aneuploid,diploid,haploid,polyploid
101879,adaptive traits escape extinction produced,a,random mutations,based needs,based lives,competition
101880,negative effect survival ecosystem,b,prey,introduction competing,predators,diversity
101881,studies snail fossils egypt indicate areas now desert once thriving savannahs approximately years ago presence area,a,there humidity,there fewer nutrients,there snowfall region,there radiation region
101882,gametes males females chromosomes happens typical male female combine produce offspring,b,chromosomes shape,chromosomes doubles,chromosomes become larger size,chromosomes reduces half
101883,an object such hammer weighs moon,d,thinner,smaller diameter,stronger magnetic field,lower
101884,core divided layers outer,d,basaltic,silicate,solid iron nickel,molten iron nickel
101885,galileo first discovered planet venus goes phases just like at different times year appears shape,d,distance,distance venus,generated venus,reflected venus
101886,event variation,c,improved hunting techniques,greater environmental stress,increased immigration,introduced predators
101887,protein synthesis mrna translated into three base sequences representing amino acids signals ribosome begin translating acid sequence,a,codon,enzymes,mutation,temperature
101888,visible observers,a,reflected sunlight,absorbed,gases interior,volcanic eruptions
101889,scientists observed coral reef ecosystems certain area dying at first believed decline due rise ocean temperatures later discovered had risen,c,stop studying coral reef ecosystems until mystery solved,dig coral reefs area bring them laboratory study further,revise hypothesis look ideas causing death coral reefs,continue original hypothesis first typically accurate
101890,identify element looking structure single,a,atom,neutron,molecule,electron
101891,relationship owl mouse,d,parasite host relationship,symbiotic relationship,mutualistic relationship,predator prey relationship
101892,kinds fish live lives salt lay eggs freshwater their ability survive environments example,a,adaptation,developmental stages,habit,selective breeding
101893,steps representing photosynthesis could shown,b,scale map,labeled diagram,scale model,investigation
101894,chromosomes contain,c,23,32,46,64
101895,scientific investigation performed find affect exercise on average heart beats per minute organized displayed,a,graph,diagram,pie chart,scale drawing
101896,salvage yard contains mixture iron glass aluminum plastic property take advantage separating rest materials,a,magnetic,electrical,ductility,malleability
101897,materials allow light absorbed rest reflected called,b,translucent,opaque,transparent,reflective
101898,although no known planet our support life exists characteristics suitable others supporting artificial environments humans could live suited habitat,c,venus average ° f,jupiter radiates twice much absorbs,mars possibly frozen under,saturn composed mostly hydrogen helium
101899,kidney urea filtered glomerular membrane nephron movement across occurs without input energy factor reason absorption require,d,ph imbalance,pressure difference,increase,concentration gradient
101900,example demonstrates carrying out inquiry based science,c,students,reads book about fossils writes report,designs answer biology question,consults expert environmental issues
101901,biologists discovered beluga whales canada st lawrence river highest rates cancer among animals reason high incidence,a,pollutant runoff,average temperatures increased region,depletion natural prey ecosystem,increased levels
101902,as begin slow down they go phase where no longer able easily past passing,b,remain mixture,remain compound,become element,become compound
101903,compression wave travels medium direction displaced,c,upward,downward,direction,opposite direction
101904,students measure temperature lake probe connected computer inside classroom advantage having,a,computer automatically display graph,computer choose location place probe,computer randomly correct errors collected probe,computer determine
101905,harmful effect clearing rainforests farmland,b,makes land available local farmers,removes valuable habitat local,increases local groundwater levels,provides income local residents
101906,activities like mining burning fuel causes relative residence coal oil fossil,c,shorter relative residence,longer relative residence under natural conditions,shorter relative residence under natural conditions,longer relative residence released respiration
101907,closest,d,denser,larger,smallest parallax angle,largest parallax angle
101908,items broken down mostly amino acids,b,spaghetti noodles,hamburger patties,apple slices,cucumber slices
101909,national parks controlled fires maintained firefighters major reasons using burns maintain certain ecosystems,d,give nonnative chance colonize region,prevent spread pests damage,replace matured saplings,rid forest floor accumulated deadwood brush
101910,gene eye color located organelle,d,endoplasmic reticulum,mitochondria,ribosome,nucleus
101911,george noticed he exercises perspires perspiration begins disappear explain happens,a,his supplying needed turn sweat vapor,pores skin close shut off production perspiration,sweat glands become inactive repeated exercise,his absorbs perspiration promote cooling
101912,liquid mix to predict whether float sink beneath tools examine,c,ruler compass,microscope voltmeter,graduated cylinder balance,thermometer bunsen burner
101913,actions rate soil erodes slow erosion,d,applying nitrogen rich fertilizers,keeping grasses trimmed short,building houses stilts,planting trees along cliffs
101914,true chromosomes,a,composed protein,material living,humans chromosomes present,deoxyribonucleic acid
101915,conducts using common potentially harmful bacteria culture after working important safety practice follow,c,turn off any electrical equipment,dispose waste materials,wash hands tabletops thoroughly,return materials proper place
101916,structure heart prevents backflow circulatory,b,aorta,valve,muscle,chamber
101917,houses built sides hills actions prevent sliding down after heavy rainfalls,c,increasing slope hill,spraying herbicides hill,adding hill,removing grass hill
101918,example,d,heating block ice,heating tungsten wire until glows brightly,adding sugar crystals clear colorless,passing electric current hydrogen
101919,activity example,d,dissolving table salt,hammering aluminum thin sheets,melting gold jewelry,burning wood produce ashes
101920,country limited resources focus development technology includes,a,treatment,space exploration,robotic automation,satellite communications
101921,role chlorophyll conversion,d,chlorophyll converts energy radiant,chlorophyll excites photons stores them,chlorophyll converts nutrients order drive metabolic activities,chlorophyll absorbs converts
101922,theory,c,public support theory decreases,theory years old,technology provides updated,financial gain adding
101923,helped development theory plate tectonics,d,measuring depth oceans near deep sea trenches,detecting magnetic striations land once covered glaciers,understanding ways adapted topographical,understanding formations similar age occurring separate continents
101924,source find testing,c,local newspaper,tv news report,journals,world almanac
101925,ice small ponds drops below ° c property beneficial fish living,d,ice temperature colder,ice absorbs sunlight reflected,ice traps pollution trapped,ice had density lower
101926,prokaryotic,d,membrane,ribosome,dna,mitochondria
101927,lack impact formation fossil fuels organic debris,a,allows formation fossil fuels occur preventing complete decomposition organic debris,allows formation fossil fuels occur reducing reactivity organic debris,prevents formation fossil fuels occurring restricting increases,prevents formation fossil fuels occurring keeping materials sorting
101928,statements difference climate,d,las vegas had clear skies carson city cloudy last week,yesterday carson city had lower barometric pressure las vegas,last july las vegas had higher average carson city,carson city averages twice much rain yearly las vegas
101929,smallest part element retains properties,d,proton,nucleus,electron,atom
101930,intense pressure crust change sandstone quartzite metamorphosis properties these rocks property remain,a,mass,volume,crystal structure,particle shape
101931,spring fed stream forms pond contains watercress minnows crayfish receives hours direct sunlight every day abiotic factor ecosystem,a,pond,watercress,minnows,crayfish
101932,sodium bicarbonate nahco3 commonly known baking soda white solid can dissolve under proper conditions release co2 physical property,d,white,solid,dissolve,releases
101933,structures materials deposited buried cemented,d,intrusive structures,metamorphic,volcanic mountains,sedimentary
101934,activity directly regulated neurons,b,production sex,beating heart,shape bone growth,levels sugar
101935,cell wall while animal,b,animal cell need wall cells larger,needs wall structure support,cell needs wall regulate coming out,animal cell need wall cells stronger
101936,resource abundant nevada nonrenewable,a,copper,wind,sunlight,wood
101937,allows materials enter leave,d,wall,mitochondria,vacuole,membrane
101938,lab investigation students brand x batteries flashlight y radio after hours stops working continues work as conclude last longer conclusion accurate,b,conclusion valid tested brands,conclusion invalid test had multiple variables,conclusion valid conducted investigation lab,conclusion invalid real names batteries hidden
101939,work together direct movement,d,peripheral nerves glands,heart brain,heart vessels,biceps muscle ulna bone
101940,photovoltaic capture photons sunlight transform them directly electricity energy resources simply transformed solar store did begin,c,oil coal,wind wood,nuclear geothermal,hydropower natural
101941,example natural satellite,c,nebula,hubble space telescope,moon,galaxy
101942,wood nonrenewable resource,a,trees harvested replanted,trees harvested replanted,trees resource,trees material resource
101943,currents accurate,d,currents influence life shore,ocean currents keep unstable,currents major glacier formation,currents stir nutrients help production
101944,biotic components need recycled ecosystem able recycle nutrients back,a,decomposers,predators,producers,scavengers
101945,adding proton atom,b,electron added,atomic,total atom,electrical charge become neutral
101946,studying major catastrophic events earth past like volcanic eruptions asteroid impacts propose theories kind effects had climate habitats looking,a,extinctions fossil record,movement tectonic plates,similar events,theory natural selection
101947,believe crater gulf mexico impact asteroid major event history example n,b,volcanic eruption,major catastrophic event,major climate,continental drift
