id,question,correctanswer,answera,answerb,answerc,answerd
101287,ship sank atlantic ocean near cape town south africa spilled tons oil impact spill ecosystem,c,benefit obtaining nutrients oil,predators due animals being killed oil,sea birds harmed oil feathers,bottom dwelling shellfish affected
101288,hard hat protect investigation,b,field trip museum geology,field investigation layers hillside,laboratory demonstration hardness minerals,laboratory investigation identification fossils
101289,universities across country come voluntary oaths science students an example oath i pledge take account social consequences any experiments consider reason colleges developing,a,need aware ethical concerns,science involves investigation topics,students coming out college live competitive world,students know science important career choice
101290,unicellular,b,virus,amoeba,mushroom,ant
101291,according fossil record first horses smaller modern throughout gradually changed,c,become better hunters,order re populate,response altering,become useful humans
101292,basis modern theory evolution proposed,d,francis crick,robert hooke,carl linnaeus,charles darwin
101293,there several different types rock formed under conditions sedimentary such shale sandstone,c,particles heated,particles melted together magma,particles compressed layers,particles changed liquids
101294,describes,c,star rocky material,star size sky,star center our,planet center our
101295,light sometimes behaves waves times particles property equally explainable treating either,b,interference,reflection,diffraction,polarization
101296,definition heredity,d,transfer learning generation next,transfer visible features generation next,passage dominant genes generation next,passage generation next
101297,student substance lacking definite shape description also states particles matter close each other still able flow past describing,b,solid,liquid,mixture,compound
101298,javier exercises his muscle cells need more oxygen help receive,c,decreasing his respiration,increasing his perspiration,increasing his heart beats,decreasing his flow
101299,generated students count record pond,a,data,variables,hypothesis,conclusion
101300,activity help pollution,b,burning crops,driving hybrid car,burning household garbage,using coal produce
101301,stimulus causes porcupine extend quills,c,lunar effect,seasonal,threatening behavior predators,environmental encroachment humans
101302,animals always produced,b,sugar,heat,oxygen,starch
101303,polar bears well adapted arctic due white fur coats coat color possibly favored natural selection colors,b,polar bears choose mates whitest coat color,polar bears white coats better camouflaged,white coat color able capture,white coat color attracts prey
101304,as our did higher proportion radioactive elements protoplanets influence planetary development,c,reinforced compression caused gravity,powered motion toward final orbits,provided source help drive layer differentiation,altered elements so compositions
101305,paleontologists construct model dinosaur fossil bones teeth help infer except,d,height dinosaur,dinosaur ate,length dinosaur,skin color dinosaur
101306,discovery provides evidence age our,b,oldest known been dated billion years old,apollo mission been dated billion years old,volcanic activity occurs recycled least once since formation,apollo missions gathered rocks similar age oldest known
101307,majority fresh frozen glaciers ice caps climate changed around world causing melt situation occur,d,land become fertile,temperatures,become saltier,land masses become smaller
101308,pair systems functions closely together,d,nervous excretory,digestive muscular,skeletal circulatory,respiratory cardiovascular
101309,greatest impact ozone layer had geosphere,c,ozone layer served catalyst oxidization exposed iron containing,ozone layer prevented being broken down high ultraviolet,presence ozone layer necessary formation organic sedimentary,presence ozone layer allowed start eroding exposed
101310,produces hormones regulate growth,d,skeletal,digestive,circulatory,endocrine
101311,pepsin enzyme acts stomach protein digestion main role metabolic reaction,a,speed reaction,reduce loss,control direction reaction,protect reaction chemicals
101312,practice prevent public experiencing harmful side effect medication,c,release partial list showing minor side effects,destroy medicines may side effects,perform high quality consistent testing medicine,maintain accurate records much medicine sold
101313,microfilaments microtubules cytoskeleton eukaryotic,c,cellulose,nucleic acids,protein,polysaccharides
101314,person hand near open flame,a,motor neurons activating muscles hand,sensory neurons incoming determine response,brain required integrate incoming outgoing,interneurons detect
101315,role reactions cycle,d,reactions transform common elements,reactions create byproduct natural processes,reactions carbon reduce total planet,reactions incorporate carbon compounds release
101316,part atom occupies majority volume,d,nucleus,protons,neutrons,electrons
101317,group scientists believe discovered toxin may certain disease publish journal,c,know become famous writing important topics,people scientific community like read current discoveries,people community further studies causes disease,hope readers journals research topics diseases
101318,common renewable resource deserts,d,biodiesel,uranium,natural,solar
101319,as humans travel space gas provided atmosphere spacecraft removed,a,provided removed,provided removed,provided nitrogen removed,provided nitrogen removed
101320,single celled like yeast algae reproduce ways including budding binary fission types,a,asexual reproduction,meiosis,sexual reproduction,differentiation
101321,rutherford caused high particles bounce off metal while pass straight,c,waves,magnetic waves,positive charges,negative charges
101322,main reason concern destruction coral reefs related global warming,c,colorful fish live coral reefs,coral reefs ideal locations studying marine life,hundreds thousands depend coral reefs,coral reefs reduce shoreline damage tsunamis
101323,source electricity harm least,a,power,diesel generator,hydroelectric dams,power lines
101324,students studying atmosphere want display percentage greenhouse compared total gases representation appropriate displaying percentages,c,bar graph,line graph,pie chart,table
101325,student determined density bars soap check accuracy,d,complete day,test multiple brands soap,record metric units,repeat
101326,warm,d,earthquake,snowfall,tsunami,rainfall
101327,shows levels organization multicellular least complex,d,tissues systems organs,organs systems tissues,systems organs tissues,tissues organs systems
101328,example environmental condition directly contributes extinction,c,introduction humans,addition sources,loss habitat,migration regions
101329,layers mostly solid material,b,inner core outer,crust inner core,crust mantle,mantle outer core
101330,fruit flies red eyes dominant sepia male crossed female producing first generation offspring had indicate,c,parents homozygous trait,parents heterozygous trait,male heterozygous female homozygous recessive trait,male homozygous dominant female heterozygous trait
101331,limestone subjected pressure,c,sandstone,basalt,marble,granite
101332,male peacocks brightly colored tail feathers reason,a,attract potential mates,distract potential predators,help catch,preserve warmth
101333,major difference umbilicus placenta,c,umbilicus delivers nutrients developing fetus placenta transfers wastes mother,umbilicus transfers wastes mother placenta delivers nutrients developing fetus,umbilicus located developing fetus placenta mother uterus,umbilicus located mother uterus placenta developing fetus
101334,cycle accelerated,b,runoff,evaporation,precipitation,condensation
101335,thin semi permeable membrane encloses allows nutrients enter wastes,d,digested,recycled,protected,excreted
101336,you see color red stop sign really seeing,c,exact color stop sign,multiple colors blending,interacted sign,your mind filtering out colors
101337,recent study funded medical corporation concluded product harmful consumers reported identify possible problem,b,corporate scientists training,study may influenced bias,privately funded science verified,study cannot repeated
101338,order processes sedimentary cycle,a,weathering > transportation deposition lithification,weathering > deposition transportation lithification,lithification > deposition transportation weathering,weathering > transportation lithification deposition
101339,layer nuclear fusion occur,a,core,radiative zone,convection zone,chromosphere
101340,ball rest acted upon any motion,d,acceleration,acceleration,direction,not
101341,affected disease causes bones become weak brittle,c,excretory,muscular,skeletal,nervous
101342,milky way galaxy visible bright region night sky modern telescopic observation possible discover brightness due primarily structure,b,clouds hot,numbers,high compounds,extremely reflective ice particles
101343,n sequence nucleotides mrna tells ribosome end amino acid release protein,c,exon,repressor protein,stop codon,operon
101344,cell structures converts nutrients functions,c,membrane,chloroplasts,mitochondria,endoplasmic reticulum
101345,sugar composed hydrogen example,b,atom,compound,electron,mixture
101346,direct observation has shown composition overall similar mantle similarity been interpreted supporting theory,d,material outer,capture asteroid belt,splitting off earthlike planet similar,material ejected collision early another planet
101347,scientist doing investigation effects fluoride tooth enamel any important maintain credibility,a,allow verified,allow published journals,conduct investigation under supervision high ranking,conduct investigation university campus access equipment
101348,happens enzyme loses shape,b,nothing function normal,becomes nonfunctional,reconfigure perform normally,takes role another protein performs task
101349,been able propose theories major geological features like grand canyon assume processes today occur,a,similar processes past,quickly processes past,slower processes past,fewer unconformities processes past
101350,spectrum visible light seen rainbow white,b,reflected transmitted,refracted dispersed,absorbed diffracted,produced emitted
101351,researchers developing types crop plants desirable characteristics such disease resistance drought tolerance crossing so next generation express traits described,a,selective breeding,natural selection,engineering,gene sequencing
101352,student asked compare general characteristics red star blue factual based solely color,a,blue star hotter red,blue star smaller red,red star farther blue,red star greater apparent magnitude blue
101353,composition soil influences ability retain transmit planting productive garden,b,sandy soils provide high silica content,loamy soils contain sand clay,slightly rocky soils provide needed minerals,clay soils heavy retain
101354,meteorite determine age,c,dating,geometric dating,radiometric dating,silicate mineral dating
101355,jake testing affects growth he grows plants identical pots fertilizer shade part indicates control investigation,c,he growing identical pots,he using,he growing out,he using fertilizer
101356,activities average us household,a,flushing toilets washing clothes,washing clothes using sink faucets,using sink faucets showering,showering flushing toilets
101357,reason reaches,a,closest star,closest planet,bigger any star space,star gives off
101358,to help survive organism capsule endospore pili group belong,a,bacteria,mollusk,insect,reptile
101359,step ensure investigation valid,c,using computer graph,verifying match original hypothesis,comparing those,eliminating any appear abnormal
101360,relative dating determine estimate ages sedimentary based know cyclewhich statements correct,b,youngest rocks found bottom layers while older top,oldest rocks found bottom layers while youngest top,youngest rocks found center layers while oldest surrounding,oldest rocks found center layers while youngest surrounding
101361,structure cells animal,b,membrane,wall,nucleus,cytoplasm
101362,weathering landforms depends various factors area fastest,b,freezing dry regions,warm moist regions,cool humid regions,hot dry regions
101363,an object floating without any gravitational acting upon,a,weight,weight,volume,volume
101364,velocity requires magnitude value direction considered n,b,measurable quantity,vector quantity,immeasurable quantity,distance quantity
101365,doctors suggest people get flu vaccine year,b,viruses replicate rapidly,viruses mutate year,vaccines absorbed after year,vaccines get stronger
101366,composed primarily hydrogen helium,b,mercury,jupiter,mars,venus
101367,celestial object listed below greatest density,d,planet,comet,nebula,neutron star
101368,observed ice component comets observation reinforced model history our,b,our originally had oceans,comets delivered oceans,planetary cores generally mix iron,our migrated comets
101369,wind becoming common source farms require open spaces turbines negative consequence technology,c,inexpensive source,little pollution,may hurt flying animals area,renewable source
101370,converts sunlight energy compound stores,b,phototropism,photosynthesis,respiration,pollination
101371,given liquid compound beaker way describe,d,definite shape indefinite volume,indefinite shape volume,definite shape volume,indefinite shape definite volume
101372,tectonic event contribute formation sedimentary basin,c,erosion material around hardened neck ancient volcano,exposure clastic intense levels pressure,divergence crustal plates forming long rift,convergence continental plates
101373,bonding red important body enables,d,absorb nutrients,make,maintain constant,perform aerobic respiration
101374,moons orbit planets,a,sun,halley comet,asteroid belt,black hole
101375,common greenhouse gases altering,a,air,density,intensity visible,thickness ozone layer
101376,organ primarily exchanges gases,d,excretory,nervous,skeletal,respiratory
101377,landscapers frequently grass steep hills yards housing developments help conserve,c,grass provides shade so stays cool,grass attracts insects enrich laying eggs,roots grass spread out hold topsoil place,roots grass protect effects acid rain
101378,scientist help sure unbiased,d,keep secret,math without calculator,variables,ask attempt reproduce
101379,process occurs star converts matter into energy includes conversion,b,split decreasing average size atomic nuclei,fuse increasing average size atomic nuclei,release electrons positive ions,acquire electrons negative ions
101380,main contributor formation hurricanes,b,high barometric pressure,warm,calm,dense
101381,students investigating whether ants attracted sugar salt bowl placed distance colony observe substance eat first appropriate hypothesis investigation,b,salt ants ate sugar instead,ants prefer sugar eat before eating salt,ants ate sugar before eating salt like,sugar placed near ant colony ants eat before eating salt
101382,digestion breaks down proteins smaller rebuild undergo,d,division,nuclear reactions,natural selection,changes
101383,factor diseases such cancer within,b,traumatic injury occurred,disruption cycle taken place,response immune triggered allergic reaction,mutation occurred crossing
101384,observed shells marine bivalves vulnerable physical damage others could differences affect accuracy fossil record,d,reducing likelihood transition fossils survive,allowing fossil characteristics fossilization,increasing total bivalve fossils available study,affecting proportions fossils survive
101385,law states appear disappear reactions,c,conservation,atom stability,conservation matter,balancing equations
101386,function mitochondria,b,store,make,proteins,store nutrients
101387,might difficult determine inherited eye color baby based her mother father,c,color baby eyes tends,baby may inherit either mother father,eye color determined several genes,genes eye color come grandparents mother father
101388,dr garcia gave each six groups students beaker filled ml sample fluid he asked his identify measuring started boil given thermometer hot plate necessary safety equipment came own results perform replicate,b,average boiling point six groups,show similar testing samples again,compare beaker,sure safety equipment cleaned
101389,order distinguish fact opinion conclusions experiments,c,recorded computer,presented bar graphs,based verifiable,organized table
101390,lifetime object known brightness color,a,star,moon,asteroid,planet
101391,humans cannot survive without clean fresh water reservoirs vary spends atmosphere source,b,lakes,oceans,rivers,glaciers
101392,carnivorous animals share habitat ecosystem may,b,become decomposers,compete,produce own,mate
101393,earthworms randomly throughout topsoil affect,c,compacting topsoil,decreasing fertility topsoil,adding nutrients topsoil,removing minerals topsoil
101394,mountains occur huge ranges stretching thousands miles event formation mountain,d,erosion,violent earthquakes,volcanic eruption,movement plates
101395,conversion nitrogen ammonia,d,ammonification,assimilation,denitrification,nitrogen fixation
101396,peripheral nervous composed neurons,c,sensory function,brain spinal cord,outside brain spinal cord,inside cerebellum brain stem
101397,very important part physical weathering rock properties causing,c,room,contain minerals,expands freezes,dissolves chemicals
101398,an agricultural scientist george washington carver famous his research,b,tobacco,peanuts,mold,corn
101399,when sugar heated hot plate turns liquid cooled hard crystalline substance model demonstrates formation,b,molten,igneous,sedimentary,metamorphic
101400,phase absorbed substance,a,gas,solid,solid,gas
101401,doctor prescribes antibiotics fight infection,b,viruses,bacteria,hiv,flu
101402,increases reaction,a,increasing reaction,using larger particles solid reactants,reducing concentration reactants,adding inhibitor reaction mixture
101403,wants cross parent mice produce offspring black fur white color b dominant genotypes,d,bb,bb,bb,bb
101404,nerve transmitting messages demonstrate primary function,a,transfer,exchange gases,elimination waste,absorption nutrients
101405,example element commonly living non things,a,carbon,dna,molecules,cells
101406,object placed fluid exerts upward called choices,b,applied,buoyant,normal,tension
101407,first american astronauts planning walk on moon knew gravity with did expect,c,mass,height,weight,volume
101408,group students researching changes climate region provide evidence rainfall period years,a,tree rings,pollen samples,harvest production,dating
101409,example primary ecological succession,d,animals invading abandoned crop field,mangroves stabilizing soils tropical coasts,minerals spurring rapid growth,lichen growth
101410,example properly communicating step science investigation,d,pour little bit grams baking soda,measure out ml pour pinch baking soda,put baking soda,measure out ml pour grams baking soda
101411,unit measure distance,a,year,angstrom unit,astronomical unit,apparent magnitude
101412,cars equipped catalytic converter device helps remove hydrocarbons oxides car exhaust as,b,production ozone,production smog,emission nitrogen,emission
101413,plants break rocks into tiny pieces possible able mechanically weather breaking them smaller,a,roots grow cracks forcing them break,absorbs leaving dry brittle,wraps itself around forces crumble,acidity forms types smaller
101414,example interaction digestive endocrine reproductive systems,c,low levels insulin stimulate hormone increases nutrient absorption,digested provides building blocks making insulin pepsin insulation,amino acids absorbed circulatory produce hormones gamete production,hormones circulatory thickening stomach wall nutrient absorption
101415,asexual reproduction leads similarity among offspring,c,fewer mutations reproduce asexually,mutations reproduce asexually,parent contributes offspring,parents contribute offspring
101416,mitochondria release,d,proteins,dna,rna,energy
101417,helps produce urine humans mammals,c,bladder,urethra,kidneys,ureter
101418,mass size nucleus atom compare entire,a,masses similar nucleus much smaller,volumes similar nucleus much,masses similar nucleus much larger,volumes similar nucleus much
101419,resource non renewable,a,oil,solar,water,wind
101420,substance elements been chemically combined called,a,compound,atom,mixture,solution
101421,tug war game balanced forces represented teams flag,a,stay middle,fall ground,slowly direction,pulled quickly direction
101422,role centromere play cellular reproduction,d,area where microtubules,area where nucleus division,area alignment chromosomes,area attachment chromatids
101423,keeps orbits around,a,gravity,magnetism,electricity,friction
101424,primary source energy nearly life green utilize,a,green convert radiant compounds,green convert thermal organic compounds,green electromagnetic release,green mechanical release
101425,distance next closest star proxima centauri accurately measured,b,magnitudes,years,perigees,red shifts
101426,where proteins synthesized,b,mitochondria,ribosomes,centrioles,lysosomes
101427,produces tiny plants around edges leaves fall ground take root become example,b,sexual reproduction,asexual reproduction,evolution,extinction
101428,investigations pictures camera useful,c,studying bird calls,studying exothermic reactions,studying growth,studying diffusion
101429,students conducting lab investigation procedures ensure collected reliable,a,record soon collected,support conclusion,eliminate conflict hypothesis,perform single trial avoid conflicting
101430,elements column periodic table,c,protons,share atomic structure,similar physical characteristics,share neutrons
101431,constructing graph investigation independent variable usually placed,c,title top,side graph,x axis graph,y axis graph
101432,dr tanaka discovered virus single strand nucleic acid she know dna rna after running tests concludes lead her conclusion,c,contains uracil,contains adenine,contains thymine,contains cytosine
101433,field mice primary source horned owls area due drought left,b,horned owl consume field mice,horned owls follow field mice area,horned owl area,horned owls based diet
101434,black bears white tailed deer sometimes habitat occupy niches difference niche,c,habitat where animal finds niche physical characteristics,habitat where animal hibernates niche determines well competes,habitat where animal lives niche defines role ecosystem,habitat where animal sleeps niche defends itself
101435,snow falls sierra nevada major source supply,d,nevada,colorado,arizona,california
101436,reproduction structure enlarges become fruit,b,seed,ovary,ovule,embryo
101437,factors contribute size,b,birth rate emigration,birth rate immigration,death rate emigration,death rate immigration
101438,sickle cell anemia disease caused autosomal recessive gene parent carries allele chances child,b,no chance,four,four,three four
101439,students finished laboratory using chemicals sure they safely disposed,d,poured chemicals down sink drain,placed chemicals carefully trash,placed back original container,followed directions provided teacher
101440,great basin nevada characterized uplifted tilted blocks forming mountain ranges downthrown basins,b,metamorphic,sedimentary,intrusive igneous,extrusive igneous
101441,multicellular grow size producing,a,cells,organs,heart muscle,chlorophyll
101442,high temperatures lack rainfall sharp decline fish lake example,b,abiotic factors increasing runoff pollution,abiotic factors decreasing availability resources,biotic factors increasing salt content resources,biotic factors contributing decline life
101443,indicates physical occurs digestion,d,addition acids create ball,secretion pepsin proteins peptides,breakdown substances digestive juices,squeezing intestines
101444,importance nitrogen cycling matter,a,nitrogen increases protein production,nitrogen decreases protein production,nitrogen decreases effectiveness photosynthesis,nitrogen increases effectiveness photosynthesis
101445,minerals identified using hardness streak cleavage,d,minerals inorganic,crystal structure too hard determine,crystal size determined,minerals recognizable properties
101446,egg sperm fuse zygote called,a,fertilization,binary fission,nondisjunction,mitosis
101447,an important rule students know heating test tube,b,place cork mouth test tube,point mouth test tube away others,hold test tube loosely fingertips,shake test tube forcefully keep contents mixed
101448,deer eat types ecosystem method show percentages diet,a,pie chart,bar graph,line graph,scatterplot
101449,a flock canada geese were migrating western central america storm blew off course landed on pacific island as adapted lost ability fly after generations ground dwelling birds nested rocky ledgeswhich conclusion based,a,random gene frequency lead loss particular alleles,specific variation young produced,random interchanges alleles individuals produce heterozygous offspring,specific interchanges within gene composition somatic lead loss function
101450,according periodic table metals except,c,sodium,zinc,fluorine,calcium
101451,designs test effect acidic solutions growth tomato plants week period five placed separate containers tested action necessary produce valid,c,seedling beginning investigation,receive mixture solutions,come source,tomato
101452,parts florida experienced brush fires affected counties happen scorched land,c,land undergo primary succession lichens reestablish habitat,land lie bare until migrate changed landscape,land restored previous community,land converted extensive agricultural
